{
  "$schema": "../../schema/plant-entry.schema.json",
  "id": "ceratozamia",
  "type": "genus",
  "name": "Ceratozamia",
  "scientific_name": "Ceratozamia",
  "authority": "Brongn.",
  "taxonomy": {
    "kingdom": "Plantae",
    "division": "Cycadophyta",
    "class": "Cycadopsida",
    "order": "Cycadales",
    "family": "Zamiaceae",
    "genus": "Ceratozamia",
    "species": []
  },
  "description": "[FILL IN] Ceratozamia is a genus of cycads in the family Zamiaceae, native primarily to Mexico with a few species extending into Guatemala and Belize. The genus is distinguished by the paired horn-like processes (hence 'cerato', from the Greek for horn) on the sporophylls of both male and female cones. Most species inhabit cloud forests and moist mountain habitats.",
  "etymology": "[FILL IN] From the Greek 'keras' (horn) and 'Zamia', referring to the paired horn-like projections on the cone scales.",
  "conservation_status": {
    "status": "Varies by species",
    "notes": "[FILL IN] Most species are Endangered or Critically Endangered due to restricted ranges and habitat degradation."
  },
  "distribution": {
    "native_range": [],
    "habitat": "[FILL IN] Cloud forests, humid montane forests, and moist ravines; often in shaded or semi-shaded conditions.",
    "altitude_range_m": "[FILL IN]"
  },
  "morphology": {
    "growth_form": "[FILL IN] Small to medium cycad; stem may be subterranean or short above ground.",
    "height_m": "[FILL IN]",
    "stem": "[FILL IN] Mostly subterranean or short cylindrical trunk.",
    "leaves": "[FILL IN] Pinnately compound; leaflets lanceolate, often with undulate or entire margins; some with golden-bronze new growth.",
    "reproductive_structures": "[FILL IN] Dioecious; cone sporophylls bear distinctive paired horn-like processes. Male cones cylindrical; female cones barrel-shaped.",
    "seeds_or_spores": "[FILL IN] Seeds with fleshy, coloured sarcotesta.",
    "roots": "[FILL IN] Coralloid roots with nitrogen-fixing cyanobacteria."
  },
  "ecology": {
    "pollination": "[FILL IN] Insect pollination; beetles recorded as primary pollinators in some species.",
    "seed_dispersal": "[FILL IN] Vertebrate-dispersed via fleshy sarcotesta.",
    "symbioses": "[FILL IN] Cyanobacterial nitrogen fixation in coralloid roots.",
    "associated_species": []
  },
  "uses": {
    "cultural": "[FILL IN]",
    "food": "[FILL IN]",
    "medicinal": "[FILL IN]",
    "horticultural": "[FILL IN] Grown by collectors; shade-tolerant habit makes some species suited to indoor or shaded garden settings.",
    "economic": "[FILL IN]"
  },
  "cultivation": {
    "hardiness_zones": "[FILL IN]",
    "soil": "[FILL IN] Rich, well-drained, humus-rich soil.",
    "light": "[FILL IN] Partial to full shade; more shade-tolerant than most cycads.",
    "watering": "[FILL IN] Regular moisture; does not tolerate prolonged drought.",
    "propagation": "[FILL IN] Seed.",
    "notes": "[FILL IN] CITES Appendix I or II; all parts toxic."
  },
  "threats_and_conservation": "[FILL IN]",
  "notable_species": [
    {
      "scientific_name": "Ceratozamia mexicana",
      "common_name": "Mexican ceratozamia",
      "notes": "[FILL IN]"
    },
    {
      "scientific_name": "Ceratozamia robusta",
      "common_name": "[FILL IN]",
      "notes": "[FILL IN]"
    },
    {
      "scientific_name": "Ceratozamia hildae",
      "common_name": "Bamboo cycad",
      "notes": "[FILL IN]"
    }
  ],
  "gallery": [
    {
      "filename": "[FILL IN]",
      "caption": "[FILL IN]",
      "credit": "[FILL IN]",
      "license": "[FILL IN]"
    }
  ],
  "references": [
    "[FILL IN citation 1]",
    "[FILL IN citation 2]"
  ],
  "external_links": [
    {
      "label": "Ceratozamia — Plants of the World Online",
      "url": "https://powo.science.kew.org/taxon/urn:lsid:ipni.org:names:30001526-2"
    },
    {
      "label": "Ceratozamia — IUCN Red List",
      "url": "https://www.iucnredlist.org/search?query=ceratozamia&searchType=species"
    }
  ],
  "categories": [
    "Cycads",
    "Zamiaceae",
    "Gymnosperms",
    "Mexican plants",
    "Endangered species"
  ],
  "last_edited": "2026-06-22"
}
