{
  "$schema": "../../schema/plant-entry.schema.json",
  "id": "stangeria",
  "type": "genus",
  "name": "Stangeria",
  "scientific_name": "Stangeria",
  "authority": "T.Moore",
  "taxonomy": {
    "kingdom": "Plantae",
    "division": "Cycadophyta",
    "class": "Cycadopsida",
    "order": "Cycadales",
    "family": "Stangeriaceae",
    "genus": "Stangeria",
    "species": ["Stangeria eriopus"]
  },
  "description": "[FILL IN] Stangeria is a monotypic genus containing only Stangeria eriopus, the sole member of the family Stangeriaceae. It is endemic to South Africa and Mozambique and is unusual among cycads in having fern-like leaves that caused it to be mistakenly classified as a fern upon its original discovery. It is a small, largely subterranean cycad of coastal grasslands and forests.",
  "etymology": "[FILL IN] Named in honour of Dr William Stanger (1811–1854), first Surveyor-General of Natal, South Africa.",
  "conservation_status": {
    "status": "Vulnerable (VU)",
    "notes": "[FILL IN] Listed as Vulnerable by the IUCN; threatened by habitat loss and collection for traditional medicine (muti)."
  },
  "distribution": {
    "native_range": ["South Africa (KwaZulu-Natal, Eastern Cape)", "Mozambique"],
    "habitat": "[FILL IN] Coastal grassland, scrub forest, and forest margins; usually on sandy or loamy soils.",
    "altitude_range_m": "[FILL IN]"
  },
  "morphology": {
    "growth_form": "[FILL IN] Small, largely subterranean cycad.",
    "height_m": "[FILL IN] Leaves typically 0.5–1.5 m long; stem mostly below ground.",
    "stem": "[FILL IN] Mostly subterranean; carrot-like tuberous root-stem.",
    "leaves": "[FILL IN] Pinnately compound; uniquely fern-like in appearance with softly textured, undulate leaflets; midrib conspicuous.",
    "reproductive_structures": "[FILL IN] Dioecious; cones emerge at ground level. Male cones elongated; female cones ovoid.",
    "seeds_or_spores": "[FILL IN] Seeds red when ripe, with fleshy sarcotesta.",
    "roots": "[FILL IN] Coralloid roots with nitrogen-fixing cyanobacteria."
  },
  "ecology": {
    "pollination": "[FILL IN] Insect-pollinated.",
    "seed_dispersal": "[FILL IN] Vertebrate-dispersed via fleshy sarcotesta; mongooses and other small mammals recorded.",
    "symbioses": "[FILL IN] Nitrogen-fixing cyanobacteria in coralloid roots.",
    "associated_species": []
  },
  "uses": {
    "cultural": "[FILL IN] Used in traditional Zulu medicine (umTholo); roots used as protective charms and medicine.",
    "food": "[FILL IN]",
    "medicinal": "[FILL IN] Roots used in traditional medicine; harvesting has depleted wild populations.",
    "horticultural": "[FILL IN] Grown by enthusiasts; requires warm, humid conditions.",
    "economic": "[FILL IN]"
  },
  "cultivation": {
    "hardiness_zones": "[FILL IN]",
    "soil": "[FILL IN] Well-drained, sandy to loamy soil with organic matter.",
    "light": "[FILL IN] Partial shade (forest form) to full sun (grassland form).",
    "watering": "[FILL IN] Regular moisture; tolerates brief drought.",
    "propagation": "[FILL IN] Seed.",
    "notes": "[FILL IN] CITES Appendix II; exists in two ecotypes (grassland and forest)."
  },
  "threats_and_conservation": "[FILL IN]",
  "notable_species": [
    {
      "scientific_name": "Stangeria eriopus",
      "common_name": "Natal grass cycad / Umphanga",
      "notes": "[FILL IN] The only species in the genus; two distinct ecotypes recognised (grassland and forest forms)."
    }
  ],
  "gallery": [
    {
      "filename": "[FILL IN]",
      "caption": "[FILL IN]",
      "credit": "[FILL IN]",
      "license": "[FILL IN]"
    }
  ],
  "references": [
    "[FILL IN citation 1]",
    "[FILL IN citation 2]"
  ],
  "external_links": [
    {
      "label": "Stangeria — Plants of the World Online",
      "url": "https://powo.science.kew.org/taxon/urn:lsid:ipni.org:names:30001533-2"
    },
    {
      "label": "Stangeria eriopus — IUCN Red List",
      "url": "https://www.iucnredlist.org/species/42083/2957665"
    }
  ],
  "categories": [
    "Cycads",
    "Stangeriaceae",
    "Gymnosperms",
    "South African endemic plants",
    "Monotypic genera",
    "Vulnerable species"
  ],
  "last_edited": "2026-06-22"
}
